unit_title,Craven,Hambleton,Harrogate,Richmondshire,Ryedale,Scarborough,Selby,York,Total
Cleaners and domestics,273.0,1.0,301.0,13.0,5.0,23.0,140.0,46.0,802.0
Sales related occupations n.e.c.,66.0,12.0,146.0,3.0,17.0,16.0,8.0,488.0,756.0
Other administrative occupations n.e.c.,71.0,19.0,140.0,16.0,60.0,48.0,19.0,242.0,615.0
Marketing and sales directors,119.0,9.0,129.0,1.0,10.0,7.0,9.0,268.0,552.0
Care workers and home carers,37.0,12.0,168.0,1.0,165.0,25.0,6.0,96.0,510.0
Managers and proprietors in other services n.e.c.,56.0,12.0,44.0,3.0,15.0,9.0,0.0,333.0,472.0
Engineering technicians,69.0,12.0,84.0,7.0,36.0,28.0,60.0,127.0,423.0
Programmers and software development professionals,58.0,18.0,66.0,5.0,5.0,2.0,5.0,260.0,419.0
"Science, engineering and production technicians n.e.c.",90.0,33.0,64.0,18.0,36.0,14.0,88.0,49.0,392.0
Estate agents and auctioneers,4.0,0.0,3.0,0.0,0.0,0.0,0.0,333.0,340.0
Customer service occupations n.e.c.,56.0,7.0,127.0,7.0,13.0,16.0,21.0,90.0,337.0
Human resources and industrial relations officers,43.0,3.0,76.0,2.0,24.0,4.0,4.0,173.0,329.0
IT user support technicians,48.0,9.0,61.0,1.0,14.0,4.0,4.0,184.0,325.0
"IT business analysts, architects and systems designers",19.0,1.0,62.0,0.0,19.0,3.0,5.0,179.0,288.0
Marketing associate professionals,53.0,9.0,99.0,2.0,5.0,8.0,9.0,86.0,271.0
Chefs,23.0,0.0,161.0,1.0,5.0,43.0,0.0,36.0,269.0
Business and financial project management professionals,41.0,2.0,33.0,4.0,1.0,0.0,4.0,181.0,266.0
Engineering professionals n.e.c.,17.0,15.0,31.0,0.0,26.0,4.0,6.0,166.0,265.0
Management consultants and business analysts,54.0,0.0,35.0,2.0,12.0,1.0,0.0,156.0,260.0
Nurses,28.0,0.0,95.0,1.0,3.0,1.0,2.0,108.0,238.0
IT operations technicians,4.0,5.0,53.0,0.0,17.0,3.0,3.0,151.0,236.0
Higher education teaching professionals,3.0,0.0,18.0,0.0,0.0,0.0,7.0,203.0,231.0
Production managers and directors in manufacturing,51.0,5.0,17.0,1.0,35.0,3.0,1.0,114.0,227.0
"Book-keepers, payroll managers and wages clerks",33.0,7.0,60.0,6.0,32.0,6.0,9.0,71.0,224.0
"Property, housing and estate managers",5.0,2.0,7.0,2.0,4.0,0.0,0.0,204.0,224.0
Driving instructors,0.0,0.0,174.0,0.0,0.0,0.0,0.0,42.0,216.0
Elementary storage occupations,24.0,17.0,77.0,13.0,15.0,6.0,21.0,43.0,216.0
Kitchen and catering assistants,25.0,10.0,99.0,0.0,9.0,43.0,2.0,24.0,212.0
Sales accounts and business development managers,31.0,0.0,22.0,0.0,3.0,1.0,0.0,155.0,212.0
Buyers and procurement officers,32.0,0.0,31.0,0.0,5.0,8.0,4.0,120.0,200.0
Metal working production and maintenance fitters,4.0,14.0,41.0,0.0,3.0,3.0,85.0,47.0,197.0
Information technology and telecommunications professionals n.e.c.,19.0,5.0,31.0,0.0,2.0,1.0,1.0,136.0,195.0
Waiters and waitresses,13.0,1.0,121.0,0.0,3.0,35.0,0.0,22.0,195.0
Chartered and certified accountants,35.0,4.0,25.0,7.0,40.0,6.0,10.0,63.0,190.0
IT project and programme managers,14.0,0.0,22.0,0.0,7.0,0.0,1.0,142.0,186.0
Web design and development professionals,10.0,1.0,34.0,0.0,1.0,2.0,2.0,134.0,184.0
Civil engineers,26.0,5.0,13.0,0.0,5.0,1.0,3.0,124.0,177.0
Construction project managers and related professionals,9.0,4.0,14.0,0.0,24.0,0.0,2.0,122.0,175.0
Quality assurance and regulatory professionals,96.0,0.0,10.0,0.0,20.0,2.0,4.0,43.0,175.0
Electricians and electrical fitters,11.0,12.0,16.0,1.0,3.0,7.0,13.0,98.0,161.0
Receptionists,27.0,4.0,46.0,1.0,3.0,11.0,1.0,52.0,145.0
Teaching and other educational professionals n.e.c.,4.0,1.0,16.0,1.0,3.0,0.0,14.0,105.0,144.0
Business sales executives,55.0,7.0,33.0,3.0,1.0,0.0,1.0,43.0,143.0
Quality assurance technicians,65.0,11.0,11.0,1.0,16.0,1.0,4.0,30.0,139.0
"Estimators, valuers and assessors",5.0,3.0,6.0,0.0,0.0,2.0,0.0,121.0,137.0
Financial managers and directors,36.0,7.0,28.0,1.0,11.0,11.0,3.0,39.0,136.0
Sales and retail assistants,19.0,5.0,73.0,2.0,1.0,3.0,2.0,30.0,135.0
Caretakers,41.0,1.0,42.0,1.0,1.0,1.0,1.0,45.0,133.0
Mechanical engineers,17.0,15.0,3.0,0.0,12.0,8.0,7.0,71.0,133.0
Architects,15.0,0.0,12.0,0.0,0.0,0.0,0.0,101.0,128.0
"Vehicle technicians, mechanics and electricians",14.0,5.0,44.0,3.0,13.0,33.0,2.0,12.0,126.0
Nursing auxiliaries and assistants,12.0,3.0,29.0,1.0,3.0,14.0,2.0,61.0,125.0
Production managers and directors in construction,5.0,7.0,9.0,0.0,0.0,0.0,0.0,96.0,117.0
Health services and public health managers and directors,16.0,0.0,24.0,0.0,13.0,1.0,0.0,63.0,117.0
Office managers,26.0,3.0,34.0,0.0,5.0,1.0,2.0,46.0,117.0
Quantity surveyors,0.0,2.0,16.0,0.0,0.0,0.0,0.0,99.0,117.0
Carpenters and joiners,8.0,7.0,7.0,4.0,9.0,6.0,12.0,63.0,116.0
Elementary administration occupations n.e.c.,23.0,4.0,22.0,5.0,2.0,6.0,0.0,52.0,114.0
Customer service managers and supervisors,5.0,1.0,33.0,0.0,1.0,0.0,0.0,70.0,110.0
Biological scientists and biochemists,78.0,1.0,6.0,0.0,1.0,0.0,1.0,22.0,109.0
Health and safety officers,10.0,5.0,8.0,0.0,30.0,0.0,3.0,52.0,108.0
Teaching assistants,2.0,0.0,24.0,0.0,0.0,0.0,1.0,79.0,106.0
Draughtspersons,20.0,3.0,8.0,1.0,0.0,0.0,0.0,73.0,105.0
Financial administrative occupations n.e.c.,12.0,1.0,30.0,0.0,13.0,0.0,1.0,45.0,102.0
"Planning, process and production technicians",14.0,1.0,9.0,0.0,16.0,0.0,0.0,61.0,101.0
Van drivers,8.0,6.0,35.0,0.0,5.0,26.0,2.0,18.0,100.0
Chartered surveyors,7.0,2.0,0.0,1.0,0.0,0.0,3.0,86.0,99.0
Large goods vehicle drivers,14.0,7.0,29.0,3.0,9.0,6.0,8.0,21.0,97.0
Metal working machine operatives,19.0,19.0,7.0,4.0,6.0,6.0,4.0,30.0,95.0
Solicitors,17.0,1.0,9.0,4.0,1.0,3.0,0.0,60.0,95.0
Transport and distribution clerks and assistants,32.0,3.0,31.0,0.0,4.0,3.0,3.0,19.0,95.0
Plumbers and heating and ventilating engineers,0.0,4.0,12.0,0.0,0.0,4.0,2.0,72.0,94.0
Electrical and electronic trades n.e.c.,29.0,5.0,22.0,0.0,1.0,7.0,3.0,27.0,94.0
Veterinarians,6.0,0.0,15.0,0.0,0.0,0.0,0.0,71.0,92.0
Gardeners and landscape gardeners,2.0,2.0,20.0,1.0,1.0,3.0,0.0,63.0,92.0
Medical and dental technicians,3.0,0.0,9.0,0.0,0.0,0.0,3.0,74.0,89.0
Nursery nurses and assistants,9.0,14.0,21.0,0.0,0.0,10.0,11.0,21.0,86.0
Quality control and planning engineers,21.0,1.0,16.0,0.0,1.0,4.0,1.0,42.0,86.0
Bar staff,6.0,0.0,34.0,1.0,0.0,43.0,2.0,0.0,86.0
Design and development engineers,11.0,4.0,13.0,0.0,1.0,0.0,0.0,56.0,85.0
Purchasing managers and directors,24.0,0.0,17.0,0.0,3.0,0.0,0.0,40.0,84.0
Welding trades,0.0,42.0,10.0,1.0,7.0,14.0,1.0,8.0,83.0
Electrical engineers,4.0,1.0,11.0,0.0,4.0,11.0,4.0,47.0,82.0
Information technology and telecommunications directors,9.0,1.0,14.0,0.0,3.0,1.0,1.0,53.0,82.0
Personal assistants and other secretaries,16.0,0.0,22.0,0.0,5.0,19.0,2.0,17.0,81.0
Human resource managers and directors,8.0,0.0,22.0,0.0,6.0,0.0,2.0,42.0,80.0
Catering and bar managers,9.0,1.0,22.0,0.0,8.0,20.0,5.0,14.0,79.0
Managers and directors in storage and warehousing,16.0,0.0,9.0,7.0,2.0,1.0,0.0,41.0,76.0
Business and related associate professionals n.e.c.,6.0,1.0,20.0,0.0,0.0,0.0,0.0,48.0,75.0
Medical radiographers,2.0,6.0,0.0,0.0,14.0,0.0,0.0,52.0,74.0
Butchers,4.0,0.0,3.0,20.0,42.0,1.0,3.0,0.0,73.0
Vocational and industrial trainers and instructors,15.0,4.0,14.0,0.0,5.0,2.0,1.0,30.0,71.0
Elementary construction occupations,4.0,18.0,16.0,2.0,3.0,4.0,0.0,23.0,70.0
Senior professionals of educational establishments,3.0,2.0,13.0,0.0,1.0,0.0,1.0,49.0,69.0
Chartered architectural technologists,3.0,0.0,0.0,2.0,0.0,0.0,1.0,58.0,64.0
Laboratory technicians,48.0,0.0,6.0,0.0,0.0,0.0,1.0,9.0,64.0
Beauticians and related occupations,2.0,0.0,21.0,0.0,0.0,30.0,0.0,11.0,64.0
Conference and exhibition managers and organisers,2.0,1.0,28.0,0.0,6.0,1.0,0.0,25.0,63.0
Chemical scientists,42.0,0.0,8.0,0.0,0.0,0.0,3.0,9.0,62.0
Finance and investment analysts and advisers,15.0,2.0,21.0,0.0,10.0,0.0,2.0,12.0,62.0
Plant and machine operatives n.e.c.,9.0,5.0,10.0,0.0,0.0,1.0,2.0,35.0,62.0
Functional managers and directors n.e.c.,21.0,0.0,10.0,0.0,1.0,0.0,0.0,29.0,61.0
Stock control clerks and assistants,6.0,7.0,18.0,0.0,8.0,2.0,1.0,19.0,61.0
Other skilled trades n.e.c.,36.0,2.0,6.0,1.0,2.0,1.0,2.0,11.0,61.0
Leisure and sports managers,0.0,1.0,0.0,0.0,0.0,9.0,0.0,47.0,57.0
Company secretaries,4.0,4.0,8.0,1.0,5.0,1.0,3.0,31.0,57.0
"Sports coaches, instructors and officials",2.0,19.0,7.0,0.0,1.0,9.0,1.0,17.0,56.0
Graphic designers,14.0,0.0,15.0,0.0,3.0,0.0,2.0,21.0,55.0
Sales supervisors,6.0,2.0,28.0,1.0,2.0,2.0,1.0,13.0,55.0
Construction and building trades supervisors,5.0,1.0,3.0,0.0,0.0,0.0,0.0,45.0,54.0
Natural and social science professionals n.e.c.,54.0,0.0,0.0,0.0,0.0,0.0,0.0,0.0,54.0
Primary and nursery education teaching professionals,2.0,2.0,9.0,0.0,0.0,2.0,14.0,24.0,53.0
Welfare and housing associate professionals n.e.c.,6.0,0.0,5.0,0.0,7.0,3.0,1.0,31.0,53.0
Housekeepers and related occupations,6.0,0.0,41.0,1.0,0.0,2.0,2.0,0.0,52.0
Medical practitioners,8.0,0.0,10.0,0.0,0.0,0.0,0.0,33.0,51.0
Production and process engineers,20.0,4.0,6.0,0.0,0.0,0.0,0.0,19.0,49.0
"Business, research and administrative professionals n.e.c.",7.0,0.0,6.0,0.0,5.0,0.0,0.0,31.0,49.0
"Authors, writers and translators",0.0,0.0,4.0,0.0,2.0,0.0,6.0,36.0,48.0
Veterinary nurses,0.0,0.0,15.0,0.0,0.0,0.0,2.0,31.0,48.0
Sales administrators,11.0,0.0,17.0,3.0,1.0,1.0,1.0,11.0,45.0
Pharmacists,0.0,6.0,2.0,0.0,1.0,0.0,0.0,36.0,45.0
Security guards and related occupations,1.0,4.0,0.0,0.0,0.0,6.0,3.0,31.0,45.0
Elementary process plant occupations n.e.c.,2.0,7.0,15.0,1.0,7.0,4.0,1.0,8.0,45.0
Construction and building trades n.e.c.,9.0,2.0,9.0,0.0,0.0,0.0,7.0,17.0,44.0
Public relations professionals,5.0,1.0,10.0,0.0,1.0,2.0,0.0,24.0,43.0
Records clerks and assistants,7.0,1.0,3.0,0.0,0.0,0.0,0.0,32.0,43.0
Credit controllers,7.0,3.0,6.0,0.0,13.0,0.0,0.0,14.0,43.0
"Packers, bottlers, canners and fillers",0.0,7.0,14.0,2.0,6.0,0.0,3.0,10.0,42.0
Other elementary services occupations n.e.c.,0.0,0.0,38.0,0.0,3.0,0.0,0.0,0.0,41.0
Physiotherapists,0.0,0.0,0.0,0.0,0.0,0.0,0.0,41.0,41.0
Cleaning and housekeeping managers and supervisors,13.0,0.0,8.0,1.0,2.0,0.0,4.0,12.0,40.0
Office supervisors,4.0,0.0,8.0,0.0,15.0,0.0,0.0,13.0,40.0
"Residential, day and domiciliary  care managers and proprietors",9.0,0.0,13.0,0.0,2.0,0.0,0.0,15.0,39.0
Animal care services occupations n.e.c.,0.0,0.0,0.0,4.0,11.0,1.0,1.0,22.0,39.0
Telephone salespersons,7.0,0.0,29.0,1.0,0.0,0.0,1.0,0.0,38.0
Restaurant and catering establishment managers and proprietors,2.0,1.0,13.0,0.0,5.0,0.0,0.0,17.0,38.0
Psychologists,0.0,0.0,0.0,0.0,1.0,16.0,2.0,16.0,35.0
Dental nurses,0.0,2.0,16.0,0.0,0.0,3.0,2.0,11.0,34.0
Financial accounts managers,1.0,0.0,12.0,0.0,0.0,0.0,0.0,20.0,33.0
Vehicle and parts salespersons and advisers,3.0,1.0,17.0,3.0,0.0,0.0,2.0,6.0,32.0
Special needs education teaching professionals,0.0,0.0,6.0,0.0,0.0,0.0,4.0,22.0,32.0
Business and related research professionals,0.0,0.0,5.0,0.0,0.0,0.0,1.0,25.0,31.0
Telephonists,12.0,5.0,7.0,0.0,1.0,0.0,0.0,6.0,31.0
Construction operatives n.e.c.,0.0,10.0,5.0,0.0,0.0,0.0,0.0,15.0,30.0
Electrical and electronics technicians,6.0,0.0,4.0,0.0,4.0,0.0,0.0,15.0,29.0
Hairdressers and barbers,0.0,5.0,8.0,0.0,0.0,2.0,0.0,14.0,29.0
Metal machining setters and setter-operators,4.0,4.0,11.0,0.0,1.0,1.0,0.0,8.0,29.0
Health professionals n.e.c.,0.0,0.0,6.0,0.0,1.0,0.0,0.0,22.0,29.0
Legal associate professionals,2.0,0.0,15.0,0.0,1.0,1.0,0.0,10.0,29.0
Vehicle body builders and repairers,1.0,3.0,20.0,0.0,0.0,0.0,5.0,0.0,29.0
Health associate professionals n.e.c.,0.0,0.0,3.0,2.0,1.0,10.0,0.0,12.0,28.0
Physical scientists,17.0,0.0,0.0,0.0,0.0,0.0,0.0,11.0,28.0
Other drivers and transport operatives n.e.c.,5.0,0.0,6.0,9.0,3.0,4.0,1.0,0.0,28.0
Chief executives and senior officials,3.0,3.0,6.0,0.0,4.0,0.0,1.0,10.0,27.0
Advertising and public relations directors,2.0,0.0,9.0,1.0,0.0,2.0,1.0,12.0,27.0
Therapy professionals n.e.c.,0.0,0.0,4.0,0.0,0.0,0.0,0.0,23.0,27.0
Research and development managers,9.0,0.0,3.0,0.0,0.0,0.0,0.0,14.0,26.0
Managers and directors in retail and wholesale,5.0,0.0,0.0,0.0,10.0,0.0,0.0,11.0,26.0
Managers and directors in transport and distribution,5.0,2.0,0.0,0.0,1.0,0.0,0.0,18.0,26.0
"Journalists, newspaper and periodical editors",9.0,0.0,0.0,0.0,0.0,6.0,0.0,10.0,25.0
Insurance underwriters,1.0,0.0,9.0,0.0,1.0,3.0,0.0,11.0,25.0
Human resources administrative occupations,2.0,0.0,5.0,0.0,6.0,0.0,0.0,12.0,25.0
Fork-lift truck drivers,0.0,6.0,3.0,0.0,1.0,0.0,4.0,10.0,24.0
Conservation professionals,5.0,2.0,7.0,0.0,0.0,0.0,0.0,9.0,23.0
"Arts officers, producers and directors",2.0,1.0,5.0,0.0,0.0,4.0,1.0,10.0,23.0
Environment professionals,3.0,0.0,0.0,0.0,0.0,0.0,0.0,19.0,22.0
Secondary education teaching professionals,2.0,5.0,3.0,0.0,0.0,3.0,0.0,8.0,21.0
Communication operators,3.0,0.0,5.0,13.0,0.0,0.0,0.0,0.0,21.0
Merchandisers and window dressers,0.0,0.0,0.0,1.0,0.0,2.0,0.0,18.0,21.0
Cooks,3.0,1.0,6.0,0.0,9.0,2.0,0.0,0.0,21.0
Social workers,1.0,1.0,0.0,0.0,3.0,6.0,1.0,8.0,20.0
Sports and leisure assistants,4.0,0.0,8.0,0.0,1.0,0.0,0.0,7.0,20.0
Musicians,0.0,0.0,0.0,0.0,0.0,0.0,0.0,20.0,20.0
Legal professionals n.e.c.,10.0,0.0,0.0,0.0,0.0,0.0,0.0,10.0,20.0
Furniture makers and other craft woodworkers,4.0,8.0,0.0,1.0,0.0,6.0,0.0,0.0,19.0
Electronics engineers,6.0,0.0,0.0,0.0,0.0,0.0,0.0,13.0,19.0
Routine inspectors and testers,0.0,0.0,0.0,0.0,0.0,0.0,0.0,18.0,18.0
"Launderers, dry cleaners and pressers",0.0,0.0,18.0,0.0,0.0,0.0,0.0,0.0,18.0
Education advisers and school inspectors,1.0,1.0,0.0,0.0,0.0,0.0,0.0,16.0,18.0
Counsellors,0.0,0.0,2.0,0.0,0.0,0.0,0.0,15.0,17.0
Vehicle valeters and cleaners,13.0,0.0,2.0,1.0,0.0,0.0,1.0,0.0,17.0
Occupational therapists,0.0,2.0,0.0,0.0,0.0,0.0,0.0,15.0,17.0
IT specialist managers,1.0,0.0,0.0,0.0,2.0,0.0,1.0,13.0,17.0
Chemical and related process operatives,0.0,4.0,0.0,0.0,2.0,0.0,0.0,11.0,17.0
Social services managers and directors,2.0,0.0,0.0,0.0,0.0,0.0,0.0,14.0,16.0
Youth and community workers,3.0,0.0,0.0,0.0,0.0,2.0,0.0,11.0,16.0
Building and civil engineering technicians,5.0,1.0,0.0,0.0,0.0,0.0,0.0,10.0,16.0
"Glaziers, window fabricators and fitters",2.0,0.0,0.0,0.0,0.0,3.0,2.0,9.0,16.0
Hotel and accommodation managers and proprietors,0.0,0.0,3.0,1.0,0.0,0.0,0.0,12.0,16.0
Medical secretaries,0.0,0.0,9.0,0.0,0.0,0.0,0.0,6.0,15.0
"Skilled metal, electrical and electronic trades supervisors",0.0,3.0,2.0,0.0,1.0,0.0,0.0,9.0,15.0
Further education teaching professionals,0.0,0.0,2.0,0.0,0.0,0.0,0.0,13.0,15.0
Careers advisers and vocational guidance specialists,1.0,0.0,0.0,0.0,3.0,0.0,1.0,10.0,15.0
Farm workers,0.0,1.0,3.0,2.0,3.0,2.0,4.0,0.0,15.0
"Actuaries, economists and statisticians",6.0,0.0,0.0,1.0,0.0,0.0,0.0,8.0,15.0
Legal secretaries,2.0,0.0,12.0,0.0,0.0,0.0,0.0,0.0,14.0
Prison service officers (below principal officer),10.0,0.0,4.0,0.0,0.0,0.0,0.0,0.0,14.0
Ophthalmic opticians,0.0,0.0,0.0,0.0,11.0,0.0,3.0,0.0,14.0
Assemblers (electrical and electronic products),0.0,0.0,3.0,0.0,0.0,3.0,2.0,6.0,14.0
Mobile machine drivers and operatives n.e.c.,3.0,1.0,0.0,0.0,0.0,0.0,0.0,10.0,14.0
Artists,1.0,1.0,3.0,0.0,4.0,1.0,4.0,0.0,14.0
Painters and decorators,0.0,2.0,7.0,0.0,2.0,0.0,2.0,0.0,13.0
Bank and post office clerks,4.0,0.0,4.0,0.0,3.0,1.0,1.0,0.0,13.0
"Senior officers in fire, ambulance, prison and related services",0.0,0.0,0.0,0.0,0.0,0.0,0.0,13.0,13.0
Librarians,0.0,0.0,2.0,0.0,1.0,0.0,0.0,10.0,13.0
Pest control officers,0.0,0.0,0.0,0.0,0.0,0.0,0.0,11.0,11.0
Parking and civil enforcement occupations,7.0,0.0,4.0,0.0,0.0,0.0,0.0,0.0,11.0
"Roofers, roof tilers and slaters",0.0,0.0,0.0,0.0,0.0,0.0,0.0,11.0,11.0
Inspectors of standards and regulations,9.0,0.0,0.0,0.0,0.0,0.0,2.0,0.0,11.0
Bus and coach drivers,0.0,0.0,4.0,0.0,0.0,2.0,0.0,5.0,11.0
Telecommunications engineers,0.0,1.0,8.0,0.0,0.0,0.0,1.0,0.0,10.0
Assemblers (vehicles and metal goods),2.0,3.0,0.0,2.0,2.0,0.0,1.0,0.0,10.0
Dispensing opticians,0.0,0.0,0.0,0.0,0.0,0.0,0.0,10.0,10.0
Typists and related keyboard occupations,0.0,1.0,4.0,0.0,5.0,0.0,0.0,0.0,10.0
Bakers and flour confectioners,4.0,0.0,5.0,0.0,0.0,1.0,0.0,0.0,10.0
Housing officers,0.0,0.0,0.0,0.0,0.0,0.0,0.0,9.0,9.0
"Debt, rent and other cash collectors",0.0,0.0,3.0,0.0,0.0,0.0,0.0,6.0,9.0
Managers and proprietors in agriculture and horticulture,0.0,0.0,0.0,1.0,8.0,0.0,0.0,0.0,9.0
Steel erectors,0.0,3.0,0.0,0.0,0.0,0.0,0.0,6.0,9.0
Taxation experts,0.0,0.0,8.0,1.0,0.0,0.0,0.0,0.0,9.0
"Food, drink and tobacco process operatives",1.0,0.0,4.0,0.0,2.0,1.0,0.0,0.0,8.0
Educational support assistants,0.0,1.0,0.0,0.0,0.0,0.0,0.0,7.0,8.0
Brokers,0.0,0.0,3.0,0.0,5.0,0.0,0.0,0.0,8.0
"Tool makers, tool fitters and markers-out",7.0,0.0,0.0,0.0,0.0,1.0,0.0,0.0,8.0
Town planning officers,0.0,0.0,0.0,0.0,0.0,0.0,0.0,8.0,8.0
Call and contact centre occupations,2.0,0.0,5.0,0.0,0.0,1.0,0.0,0.0,8.0
"Product, clothing and related designers",0.0,1.0,0.0,0.0,0.0,0.0,0.0,7.0,8.0
Public services associate professionals,2.0,0.0,0.0,0.0,0.0,0.0,0.0,6.0,8.0
Pharmaceutical technicians,0.0,1.0,0.0,0.0,0.0,0.0,0.0,6.0,7.0
Senior care workers,2.0,0.0,4.0,0.0,0.0,1.0,0.0,0.0,7.0
Printers,0.0,0.0,3.0,0.0,1.0,1.0,2.0,0.0,7.0
School midday and crossing patrol occupations,0.0,0.0,0.0,0.0,0.0,0.0,0.0,7.0,7.0
Ship and hovercraft officers,0.0,1.0,0.0,0.0,0.0,0.0,0.0,5.0,6.0
"Photographers, audio-visual and broadcasting equipment operators",2.0,0.0,0.0,0.0,0.0,1.0,3.0,0.0,6.0
Houseparents and residential wardens,0.0,0.0,0.0,0.0,0.0,0.0,0.0,6.0,6.0
"Textiles, garments and related trades n.e.c.",0.0,1.0,0.0,0.0,1.0,2.0,2.0,0.0,6.0
Pre-press technicians,0.0,0.0,5.0,0.0,0.0,0.0,1.0,0.0,6.0
Travel agents,0.0,2.0,4.0,0.0,0.0,0.0,0.0,0.0,6.0
Local government administrative occupations,2.0,0.0,4.0,0.0,0.0,0.0,0.0,0.0,6.0
Pensions and insurance clerks and assistants,2.0,1.0,3.0,0.0,0.0,0.0,0.0,0.0,6.0
Childminders and related occupations,0.0,0.0,3.0,2.0,0.0,0.0,0.0,0.0,5.0
Social and humanities scientists,5.0,0.0,0.0,0.0,0.0,0.0,0.0,0.0,5.0
Tailors and dressmakers,5.0,0.0,0.0,0.0,0.0,0.0,0.0,0.0,5.0
Taxi and cab drivers and chauffeurs,0.0,0.0,3.0,0.0,0.0,2.0,0.0,0.0,5.0
"Actors, entertainers and presenters",1.0,3.0,0.0,0.0,0.0,1.0,0.0,0.0,5.0
Fitness instructors,0.0,0.0,3.0,0.0,2.0,0.0,0.0,0.0,5.0
Fishing and other elementary agriculture occupations n.e.c.,0.0,1.0,0.0,0.0,3.0,0.0,1.0,0.0,5.0
Police officers (sergeant and below),3.0,0.0,2.0,0.0,0.0,0.0,0.0,0.0,5.0
Floorers and wall tilers,0.0,2.0,3.0,0.0,0.0,0.0,0.0,0.0,5.0
Retail cashiers and check-out operators,1.0,0.0,3.0,0.0,0.0,1.0,0.0,0.0,5.0
Clergy,0.0,0.0,4.0,0.0,0.0,0.0,0.0,0.0,4.0
Leisure and theme park attendants,1.0,0.0,3.0,0.0,0.0,0.0,0.0,0.0,4.0
"Moulders, core makers and die casters",3.0,0.0,0.0,0.0,0.0,1.0,0.0,0.0,4.0
Farmers,0.0,0.0,0.0,0.0,4.0,0.0,0.0,0.0,4.0
Weavers and knitters,4.0,0.0,0.0,0.0,0.0,0.0,0.0,0.0,4.0
Street cleaners,4.0,0.0,0.0,0.0,0.0,0.0,0.0,0.0,4.0
Print finishing and binding workers,0.0,0.0,4.0,0.0,0.0,0.0,0.0,0.0,4.0
Printing machine assistants,4.0,0.0,0.0,0.0,0.0,0.0,0.0,0.0,4.0
Refuse and salvage occupations,0.0,1.0,0.0,2.0,0.0,0.0,1.0,0.0,4.0
Rail transport operatives,0.0,0.0,0.0,3.0,0.0,0.0,0.0,0.0,3.0
Quarry workers and related operatives,1.0,0.0,0.0,0.0,2.0,0.0,0.0,0.0,3.0
Plastics process operatives,0.0,0.0,3.0,0.0,0.0,0.0,0.0,0.0,3.0
Conservation and environmental associate professionals,0.0,0.0,3.0,0.0,0.0,0.0,0.0,0.0,3.0
Assemblers and routine operatives n.e.c.,0.0,0.0,2.0,0.0,1.0,0.0,0.0,0.0,3.0
Smiths and forge workers,0.0,0.0,0.0,0.0,3.0,0.0,0.0,0.0,3.0
Shopkeepers and proprietors – wholesale and retail,3.0,0.0,0.0,0.0,0.0,0.0,0.0,0.0,3.0
Shelf fillers,0.0,0.0,0.0,0.0,3.0,0.0,0.0,0.0,3.0
"Weighers, graders and sorters",3.0,0.0,0.0,0.0,0.0,0.0,0.0,0.0,3.0
"Scaffolders, stagers and riggers",0.0,0.0,0.0,2.0,1.0,0.0,0.0,0.0,3.0
Leisure and travel service occupations n.e.c.,0.0,0.0,0.0,0.0,0.0,3.0,0.0,0.0,3.0
Pipe fitters,1.0,1.0,0.0,0.0,0.0,0.0,0.0,0.0,2.0
Plasterers,0.0,0.0,0.0,0.0,0.0,0.0,2.0,0.0,2.0
NCOs and other ranks,1.0,0.0,0.0,1.0,0.0,0.0,0.0,0.0,2.0
Aircraft maintenance and related trades,0.0,0.0,0.0,0.0,2.0,0.0,0.0,0.0,2.0
Air-conditioning and refrigeration engineers,0.0,0.0,2.0,0.0,0.0,0.0,0.0,0.0,2.0
Playworkers,0.0,0.0,0.0,0.0,0.0,0.0,2.0,0.0,2.0
Bricklayers and masons,0.0,1.0,0.0,0.0,0.0,1.0,0.0,0.0,2.0
Library clerks and assistants,2.0,0.0,0.0,0.0,0.0,0.0,0.0,0.0,2.0
Agricultural machinery drivers,0.0,2.0,0.0,0.0,0.0,0.0,0.0,0.0,2.0
Agricultural and fishing trades n.e.c.,0.0,0.0,0.0,0.0,0.0,2.0,0.0,0.0,2.0
Energy plant operatives,0.0,1.0,0.0,0.0,0.0,0.0,1.0,0.0,2.0
IT engineers,0.0,2.0,0.0,0.0,0.0,0.0,0.0,0.0,2.0
Financial and accounting technicians,0.0,0.0,0.0,0.0,2.0,0.0,0.0,0.0,2.0
Elementary security occupations n.e.c.,0.0,0.0,0.0,1.0,0.0,1.0,0.0,0.0,2.0
"TV, video and audio engineers",0.0,2.0,0.0,0.0,0.0,0.0,0.0,0.0,2.0
Groundsmen and greenkeepers,0.0,0.0,0.0,0.0,1.0,1.0,0.0,0.0,2.0
Elementary cleaning occupations n.e.c.,0.0,1.0,0.0,0.0,0.0,0.0,1.0,0.0,2.0
Road construction operatives,0.0,1.0,0.0,1.0,0.0,0.0,0.0,0.0,2.0
Sheet metal workers,1.0,1.0,0.0,0.0,0.0,0.0,0.0,0.0,2.0
Production managers and directors in mining and energy,1.0,0.0,0.0,0.0,0.0,0.0,0.0,0.0,1.0
Paper and wood machine operatives,0.0,0.0,0.0,0.0,0.0,1.0,0.0,0.0,1.0
National government administrative occupations,0.0,0.0,0.0,0.0,0.0,0.0,1.0,0.0,1.0
School secretaries,1.0,0.0,0.0,0.0,0.0,0.0,0.0,0.0,1.0
Air traffic controllers,0.0,0.0,0.0,0.0,0.0,1.0,0.0,0.0,1.0
Elementary sales occupations n.e.c.,0.0,0.0,0.0,0.0,0.0,1.0,0.0,0.0,1.0
Ambulance staff (excluding paramedics),0.0,0.0,0.0,0.0,1.0,0.0,0.0,0.0,1.0
Rail construction and maintenance operatives,1.0,0.0,0.0,0.0,0.0,0.0,0.0,0.0,1.0
Florists,1.0,0.0,0.0,0.0,0.0,0.0,0.0,0.0,1.0
Dental practitioners,0.0,0.0,0.0,0.0,0.0,1.0,0.0,0.0,1.0
Industrial cleaning process occupations,0.0,0.0,0.0,0.0,0.0,0.0,1.0,0.0,1.0
Speech and language therapists,0.0,1.0,0.0,0.0,0.0,0.0,0.0,0.0,1.0
Upholsterers,0.0,0.0,0.0,1.0,0.0,0.0,0.0,0.0,1.0
"Tyre, exhaust and windscreen fitters",0.0,1.0,0.0,0.0,0.0,0.0,0.0,0.0,1.0
Collector salespersons and credit agents,0.0,0.0,0.0,0.0,0.0,0.0,1.0,0.0,1.0
Train and tram drivers,1.0,0.0,0.0,0.0,0.0,0.0,0.0,0.0,1.0
Horticultural trades,0.0,0.0,0.0,0.0,0.0,1.0,0.0,0.0,1.0
Protective service associate professionals n.e.c.,0.0,0.0,0.0,0.0,0.0,0.0,1.0,0.0,1.0
Hospital porters,0.0,0.0,0.0,0.0,0.0,1.0,0.0,0.0,1.0
